PostId,PostUrl,PostEngagement,Platform,ChannelID,ChannelName,ChannelUid,ChannelUrl,ChannelEngagement,post_body_text,GoogleAudioText,VoskAudioText,EmbeddedContentText,published_at,post_data,post_media_urls,LikesCount,SharesCount,CommentsCount,ViewsCount,post_media_file,embedded_post_text,search_data
473193270,https://twitter.com/joerogan/status/1906018955656859672,,Twitter,10183319,Joe Rogan,blank_for_now,blank_for_now,"{""follower_count"":15252150,""following_count"":3944,""like_count"":null,""post_count"":45863,""views_count"":null,""comment_count"":null,""share_count"":null}",Always a fun time with Big Jay! One of the absolute best crowd work comics of all time! He’s a got a two part crowd work special out right now on @youtube called THEM/THEY and it’s fucking awesome.  Our podcast is available now on @spotify https://t.co/mkrDtgM4s2, ,no longer populated,,2025-03-29T16:21:45.000Z,post data removed,,3521,191,341,487241,,
473289071,https://twitter.com/joerogan/status/1905657118226522346,,Twitter,10183319,Joe Rogan,blank_for_now,blank_for_now,"{""follower_count"":15251805,""following_count"":3944,""like_count"":null,""post_count"":45863,""views_count"":null,""comment_count"":null,""share_count"":null}","This one is pretty fucking nuts.  Scott Payne spent 25 years undercover for the FBI infiltrating outlaw biker gangs and neo Nazi groups, and man does this dude have some fucking insane stories.  Episode available now on @spotify https://t.co/tJpbp5QQch", ,no longer populated,,2025-03-28T16:23:57.000Z,post data removed,,13350,622,632,728242,,
467059419,https://twitter.com/joerogan/status/1905262703611883557,,Twitter,10183319,Joe Rogan,blank_for_now,blank_for_now,"{""follower_count"":15243528,""following_count"":3944,""like_count"":null,""post_count"":45866,""views_count"":null,""comment_count"":null,""share_count"":null}",https://t.co/DX4T0dU7pG, ,no longer populated,"“Dissolving Illusions” is a really great book.  I probably would have never thought about exploring the real history of vaccines if we hadn’t gone through the insane Covid gaslighting of the last 5 years, but after Dr. Humphries’ book I’ll never look at it the same way again.  She’s a very brave and brilliant woman.  @DrSuzanneH7",2025-03-27T14:16:41.000Z,post data removed,,2323,290,107,303352,,"“Dissolving Illusions” is a really great book.  I probably would have never thought about exploring the real history of vaccines if we hadn’t gone through the insane Covid gaslighting of the last 5 years, but after Dr. Humphries’ book I’ll never look at it the same way again.  She’s a very brave and brilliant woman.  @DrSuzanneH7"
466948078,https://twitter.com/joerogan/status/1905249814251504058,,Twitter,10183319,Joe Rogan,blank_for_now,blank_for_now,"{""follower_count"":15259131,""following_count"":3942,""like_count"":null,""post_count"":45865,""views_count"":null,""comment_count"":null,""share_count"":null}","“Dissolving Illusions” is a really great book.  I probably would have never thought about exploring the real history of vaccines if we hadn’t gone through the insane Covid gaslighting of the last 5 years, but after Dr. Humphries’ book I’ll never look at it the same way again.  She’s a very brave and brilliant woman.  @DrSuzanneH7", ,no longer populated,,2025-03-27T13:25:28.000Z,post data removed,,53449,9666,2359,30260474,,
465005261,https://twitter.com/joerogan/status/1904226856238231847,,Twitter,10183319,Joe Rogan,blank_for_now,blank_for_now,"{""follower_count"":15258380,""following_count"":3942,""like_count"":null,""post_count"":45865,""views_count"":null,""comment_count"":null,""share_count"":null}","Pretty fascinating deep dive into the Shroud of Turin. 

https://t.co/USL82I7PGW", ,no longer populated,,2025-03-24T17:40:36.000Z,post data removed,,23265,2783,1320,4255440,,
464684463,https://twitter.com/joerogan/status/1903912685164548430,,Twitter,10183319,Joe Rogan,blank_for_now,blank_for_now,"{""follower_count"":15243528,""following_count"":3944,""like_count"":null,""post_count"":45866,""views_count"":null,""comment_count"":null,""share_count"":null}",RT @Soaringeagle45: The day Mick told them don’t walk out on the tongue. 🤣😂🤣 https://t.co/m4z0UKjeBj, ,no longer populated,The day Mick told them don’t walk out on the tongue. 🤣😂🤣 https://t.co/m4z0UKjeBj,2025-03-23T20:52:11.000Z,post data removed,,0,901,0,31,,The day Mick told them don’t walk out on the tongue. 🤣😂🤣 https://t.co/m4z0UKjeBj
464684476,https://twitter.com/joerogan/status/1903750044852822109,,Twitter,10183319,Joe Rogan,blank_for_now,blank_for_now,"{""follower_count"":15243528,""following_count"":3944,""like_count"":null,""post_count"":45866,""views_count"":null,""comment_count"":null,""share_count"":null}",RT @TheFigen_: An Alaskan man has shared the aurora borealis view from the porch of his cabin... https://t.co/ztxU7ShuZp, ,no longer populated,An Alaskan man has shared the aurora borealis view from the porch of his cabin... https://t.co/ztxU7ShuZp,2025-03-23T10:05:55.000Z,post data removed,,0,43538,0,34,,An Alaskan man has shared the aurora borealis view from the porch of his cabin... https://t.co/ztxU7ShuZp
464684496,https://twitter.com/joerogan/status/1903538650857853301,,Twitter,10183319,Joe Rogan,blank_for_now,blank_for_now,"{""follower_count"":15243528,""following_count"":3944,""like_count"":null,""post_count"":45866,""views_count"":null,""comment_count"":null,""share_count"":null}",About to go live: https://t.co/jdbnvmqIAj, ,no longer populated,,2025-03-22T20:05:55.000Z,post data removed,,2570,150,384,1144618,,
464033295,https://twitter.com/joerogan/status/1903479320883925108,,Twitter,10183319,Joe Rogan,blank_for_now,blank_for_now,"{""follower_count"":15243528,""following_count"":3944,""like_count"":null,""post_count"":45866,""views_count"":null,""comment_count"":null,""share_count"":null}","Fight Companion today! 3pm CDT for the main @ufc card:

https://t.co/jdbnvmqaKL

Eddie Bravo, Brendan Schaub, Gordon Ryan and me", ,no longer populated,,2025-03-22T16:10:09.000Z,post data removed,,1243,82,244,658930,,
463814576,https://twitter.com/joerogan/status/1903336517243732090,,Twitter,10183319,Joe Rogan,blank_for_now,blank_for_now,"{""follower_count"":15261090,""following_count"":3941,""like_count"":null,""post_count"":45866,""views_count"":null,""comment_count"":null,""share_count"":null}",Mind fuck of the evening., ,no longer populated,https://t.co/wpT51ueyt0,2025-03-22T06:42:42.000Z,post data removed,,6702,545,2129,2234045,,https://t.co/wpT51ueyt0
463380511,https://twitter.com/joerogan/status/1903116240786207083,,Twitter,10183319,Joe Rogan,blank_for_now,blank_for_now,"{""follower_count"":15243528,""following_count"":3944,""like_count"":null,""post_count"":45866,""views_count"":null,""comment_count"":null,""share_count"":null}",RT @MikeBenzCyber: Shocking reveal in the new JFK Files that basically confirms the Pentagon creation of and intent to deploy the tick-born…, ,no longer populated,"Shocking reveal in the new JFK Files that basically confirms the Pentagon creation of and intent to deploy the tick-borne viruses (Lyme, etc) detailed in Kris Newby's book Bitten",2025-03-21T16:07:24.000Z,post data removed,,0,11581,0,1565,,"Shocking reveal in the new JFK Files that basically confirms the Pentagon creation of and intent to deploy the tick-borne viruses (Lyme, etc) detailed in Kris Newby's book Bitten"
462587142,https://twitter.com/joerogan/status/1902560857369793008,,Twitter,10183319,Joe Rogan,blank_for_now,blank_for_now,"{""follower_count"":15243528,""following_count"":3944,""like_count"":null,""post_count"":45866,""views_count"":null,""comment_count"":null,""share_count"":null}","RT @Andercot: This week in Twitter:

- The CIA killed JFK
- Giant ancient structures discovered beneath the Pyramids

Totally chill, doesn'…", ,no longer populated,"This week in Twitter:

- The CIA killed JFK
- Giant ancient structures discovered beneath the Pyramids

Totally chill, doesn't suggest updating the conventional world model at all.",2025-03-20T03:20:30.000Z,post data removed,,0,1329,0,164,,"This week in Twitter:

- The CIA killed JFK
- Giant ancient structures discovered beneath the Pyramids

Totally chill, doesn't suggest updating the conventional world model at all."
462587170,https://twitter.com/joerogan/status/1902560256732942670,,Twitter,10183319,Joe Rogan,blank_for_now,blank_for_now,"{""follower_count"":15243528,""following_count"":3944,""like_count"":null,""post_count"":45866,""views_count"":null,""comment_count"":null,""share_count"":null}","RT @disclosetv: NEW - Boston Dynamics presents the progress made in the movement capacity of its ""humanoid robot"" Atlas.

https://t.co/GJLU…", ,no longer populated,"NEW - Boston Dynamics presents the progress made in the movement capacity of its ""humanoid robot"" Atlas.

https://t.co/GJLUAtoLt4",2025-03-20T03:18:07.000Z,post data removed,,0,3132,0,12,,"NEW - Boston Dynamics presents the progress made in the movement capacity of its ""humanoid robot"" Atlas.

https://t.co/GJLUAtoLt4"
461374630,https://twitter.com/joerogan/status/1902153936666317096,,Twitter,10183319,Joe Rogan,blank_for_now,blank_for_now,"{""follower_count"":15243528,""following_count"":3944,""like_count"":null,""post_count"":45866,""views_count"":null,""comment_count"":null,""share_count"":null}",Has anyone fed the files to @grok?, ,no longer populated,"So, who killed JFK?",2025-03-19T00:23:33.000Z,post data removed,,38043,671,2013,5298758,,"So, who killed JFK?"
461374653,https://twitter.com/joerogan/status/1902152620845732230,,Twitter,10183319,Joe Rogan,blank_for_now,blank_for_now,"{""follower_count"":15259062,""following_count"":3942,""like_count"":null,""post_count"":45865,""views_count"":null,""comment_count"":null,""share_count"":null}",Wrong answers only please., ,no longer populated,"So, who killed JFK?",2025-03-19T00:18:19.000Z,post data removed,,19776,293,5926,3590737,,"So, who killed JFK?"
461372934,https://twitter.com/joerogan/status/1902152285003690296,,Twitter,10183319,Joe Rogan,blank_for_now,blank_for_now,"{""follower_count"":15263168,""following_count"":3941,""like_count"":null,""post_count"":45866,""views_count"":null,""comment_count"":null,""share_count"":null}","So, who killed JFK?", ,no longer populated,,2025-03-19T00:16:59.000Z,post data removed,,226802,12161,26520,32465938,,
460775727,https://twitter.com/joerogan/status/1901487895677960320,,Twitter,10183319,Joe Rogan,blank_for_now,blank_for_now,"{""follower_count"":15243528,""following_count"":3944,""like_count"":null,""post_count"":45866,""views_count"":null,""comment_count"":null,""share_count"":null}","RT @Rainmaker1973: The architecture of a hornets nest 
https://t.co/gHvK5e7fXR", ,no longer populated,"The architecture of a hornets nest 
https://t.co/gHvK5e7fXR",2025-03-17T04:16:56.000Z,post data removed,,0,2547,0,37,,"The architecture of a hornets nest 
https://t.co/gHvK5e7fXR"
459242628,https://twitter.com/joerogan/status/1900761716234866954,,Twitter,10183319,Joe Rogan,blank_for_now,blank_for_now,"{""follower_count"":15243528,""following_count"":3944,""like_count"":null,""post_count"":45866,""views_count"":null,""comment_count"":null,""share_count"":null}",RT @tayjmcm: I investigated if dragons were real. @joerogan might be on to something. https://t.co/E6QxRVbxsj, ,no longer populated,I investigated if dragons were real. @joerogan might be on to something. https://t.co/E6QxRVbxsj,2025-03-15T04:11:22.000Z,post data removed,,0,404,0,17,,I investigated if dragons were real. @joerogan might be on to something. https://t.co/E6QxRVbxsj
454315365,https://twitter.com/joerogan/status/1898218695618707680,,Twitter,10183319,Joe Rogan,blank_for_now,blank_for_now,"{""follower_count"":15259062,""following_count"":3942,""like_count"":null,""post_count"":45865,""views_count"":null,""comment_count"":null,""share_count"":null}","Hey, @kanyewest, I don’t know who you’re talking to but that’s not me", ,no longer populated,,2025-03-08T03:46:18.000Z,post data removed,,20601,1142,1817,1594467,,
451868743,https://twitter.com/joerogan/status/1897065293891215553,,Twitter,10183319,Joe Rogan,blank_for_now,blank_for_now,"{""follower_count"":15243528,""following_count"":3944,""like_count"":null,""post_count"":45866,""views_count"":null,""comment_count"":null,""share_count"":null}","RT @bariweiss: The Department of Justice is investigating the Greenhouse Gas Reduction Fund, a $27 billion program that was part of Joe Bid…", ,no longer populated,"The Department of Justice is investigating the Greenhouse Gas Reduction Fund, a $27 billion program that was part of Joe Biden’s $740 billion Inflation Reduction Act. Created in the spring of 2023, and managed by the Environmental Protection Agency, the fund was supposed to be a “first-of-its-kind” program to address the climate crisis while revitalizing communities that it considered “historically left behind.”

But it appears little of the $27 billion revitalized anything—except the coffers of a range of environmental nonprofits associated with former Obama and Biden administration officials.

“The Biden administration used so-called ‘climate equity’ to justify handouts of billions of dollars to their far-left friends,” @leezeldin, the Trump administration’s new EPA administrator, told @TheFP. “It is my utmost priority to get a handle on every dollar that went out the door in this scheme and once again restore oversight and accountability over these funds. This rush job operation is riddled with conflicts of interest and corruption.”

A Free Press investigation reveals that of the $27 billion, $20 billion was rushed out the door to eight nonprofit groups after Biden lost the election—but before President Donald Trump took office. As one former EPA official put it on a secretly recorded video, it was akin to “tossing gold bars off the Titanic.”

The eight groups were allocated sums ranging from $400 million to $6.9 billion. Several of them were formed in August of 2023, just one month after the grant applications went live in July of 2023, when it became clear that large nine- and 10-figure grants would be up for grabs. The boards and staff of these eight groups include Democratic donors, people with connections to the Obama and Biden administrations, and prominent Democrats like Stacey Abrams. 

“These are some of the biggest grants to individual organizations in American history.""",2025-03-04T23:23:06.000Z,post data removed,,0,16082,0,24,,"The Department of Justice is investigating the Greenhouse Gas Reduction Fund, a $27 billion program that was part of Joe Biden’s $740 billion Inflation Reduction Act. Created in the spring of 2023, and managed by the Environmental Protection Agency, the fund was supposed to be a “first-of-its-kind” program to address the climate crisis while revitalizing communities that it considered “historically left behind.”

But it appears little of the $27 billion revitalized anything—except the coffers of a range of environmental nonprofits associated with former Obama and Biden administration officials.

“The Biden administration used so-called ‘climate equity’ to justify handouts of billions of dollars to their far-left friends,” @leezeldin, the Trump administration’s new EPA administrator, told @TheFP. “It is my utmost priority to get a handle on every dollar that went out the door in this scheme and once again restore oversight and accountability over these funds. This rush job operation is riddled with conflicts of interest and corruption.”

A Free Press investigation reveals that of the $27 billion, $20 billion was rushed out the door to eight nonprofit groups after Biden lost the election—but before President Donald Trump took office. As one former EPA official put it on a secretly recorded video, it was akin to “tossing gold bars off the Titanic.”

The eight groups were allocated sums ranging from $400 million to $6.9 billion. Several of them were formed in August of 2023, just one month after the grant applications went live in July of 2023, when it became clear that large nine- and 10-figure grants would be up for grabs. The boards and staff of these eight groups include Democratic donors, people with connections to the Obama and Biden administrations, and prominent Democrats like Stacey Abrams. 

“These are some of the biggest grants to individual organizations in American history."""
451868759,https://twitter.com/joerogan/status/1897064084455240132,,Twitter,10183319,Joe Rogan,blank_for_now,blank_for_now,"{""follower_count"":15243528,""following_count"":3944,""like_count"":null,""post_count"":45866,""views_count"":null,""comment_count"":null,""share_count"":null}","RT @MikeBenzCyber: Unbelievable clip here. This was right after the Clinton admin fixed the 1996 election in Russia, and just 2 years befor…", ,no longer populated,"Unbelievable clip here. This was right after the Clinton admin fixed the 1996 election in Russia, and just 2 years before Putin took power. It's really amazing to go back and look at the Infinite Hubris of The Blob during The End Of History period.",2025-03-04T23:18:18.000Z,post data removed,,0,6552,0,44,,"Unbelievable clip here. This was right after the Clinton admin fixed the 1996 election in Russia, and just 2 years before Putin took power. It's really amazing to go back and look at the Infinite Hubris of The Blob during The End Of History period."
451868768,https://twitter.com/joerogan/status/1897059622651060418,,Twitter,10183319,Joe Rogan,blank_for_now,blank_for_now,"{""follower_count"":15243528,""following_count"":3944,""like_count"":null,""post_count"":45866,""views_count"":null,""comment_count"":null,""share_count"":null}",RT @elonmusk: Worst puppet show ever 🤡🤣, ,no longer populated,Worst puppet show ever 🤡🤣,2025-03-04T23:00:34.000Z,post data removed,,0,33387,0,368,,Worst puppet show ever 🤡🤣
450763005,https://twitter.com/joerogan/status/1896565273312022542,,Twitter,10183319,Joe Rogan,blank_for_now,blank_for_now,"{""follower_count"":15238886,""following_count"":3942,""like_count"":null,""post_count"":45866,""views_count"":null,""comment_count"":null,""share_count"":null}",RT @elonmusk: Wow, ,no longer populated,Wow,2025-03-03T14:16:12.000Z,post data removed,,0,16165,0,114,,Wow
450616318,https://twitter.com/joerogan/status/1896432888301879667,,Twitter,10183319,Joe Rogan,blank_for_now,blank_for_now,"{""follower_count"":15238886,""following_count"":3942,""like_count"":null,""post_count"":45866,""views_count"":null,""comment_count"":null,""share_count"":null}","RT @RealLoriSpencer: Bill Murray rarely gives interviews, let alone a 2.5 hour, no-holds-barred interview on a podcast. 

As a fan of Bill’…", ,no longer populated,"Bill Murray rarely gives interviews, let alone a 2.5 hour, no-holds-barred interview on a podcast. 

As a fan of Bill’s since the 70s, this is the conversation I’ve waited a lifetime for. What a gift. 

Thanks to Joe Rogan for making this happen! 👏 

 https://t.co/oaaMMW1Pdp",2025-03-03T05:30:09.000Z,post data removed,,0,637,0,15,,"Bill Murray rarely gives interviews, let alone a 2.5 hour, no-holds-barred interview on a podcast. 

As a fan of Bill’s since the 70s, this is the conversation I’ve waited a lifetime for. What a gift. 

Thanks to Joe Rogan for making this happen! 👏 

 https://t.co/oaaMMW1Pdp"
450452424,https://twitter.com/joerogan/status/1896384165815390430,,Twitter,10183319,Joe Rogan,blank_for_now,blank_for_now,"{""follower_count"":15233614,""following_count"":3943,""like_count"":null,""post_count"":45866,""views_count"":null,""comment_count"":null,""share_count"":null}","RT @wideawake_media: It takes a lot to shock Joe Rogan, but this creepily precise 1965 prediction about society's orchestrated decline mana…", ,no longer populated,"It takes a lot to shock Joe Rogan, but this creepily precise 1965 prediction about society's orchestrated decline managed to do just that—especially in light of what has transpired since then. https://t.co/hoh6ObJDn2",2025-03-03T02:16:32.000Z,post data removed,,0,3841,0,14,,"It takes a lot to shock Joe Rogan, but this creepily precise 1965 prediction about society's orchestrated decline managed to do just that—especially in light of what has transpired since then. https://t.co/hoh6ObJDn2"
450452432,https://twitter.com/joerogan/status/1896300527006413063,,Twitter,10183319,Joe Rogan,blank_for_now,blank_for_now,"{""follower_count"":15230375,""following_count"":3942,""like_count"":null,""post_count"":45864,""views_count"":null,""comment_count"":null,""share_count"":null}",RT @TheDegenWeekly: This might be the best SNL skit in the last 20 years  https://t.co/EjZyEUi5OQ, ,no longer populated,This might be the best SNL skit in the last 20 years  https://t.co/EjZyEUi5OQ,2025-03-02T20:44:11.000Z,post data removed,,0,29435,0,10,,This might be the best SNL skit in the last 20 years  https://t.co/EjZyEUi5OQ
448879947,https://twitter.com/joerogan/status/1895548829665255450,,Twitter,10183319,Joe Rogan,blank_for_now,blank_for_now,"{""follower_count"":15230375,""following_count"":3942,""like_count"":null,""post_count"":45864,""views_count"":null,""comment_count"":null,""share_count"":null}","Fun times with Captain X! @elonmusk now available on @spotify 

https://t.co/nEfCnnB6NU", ,no longer populated,,2025-02-28T18:57:13.000Z,post data removed,,17457,1616,1763,1467736,,
447596243,https://twitter.com/joerogan/status/1894949207318110489,,Twitter,10183319,Joe Rogan,blank_for_now,blank_for_now,"{""follower_count"":15230375,""following_count"":3942,""like_count"":null,""post_count"":45864,""views_count"":null,""comment_count"":null,""share_count"":null}","RT @DrAndyGalpin: If you haven't heard, there are credible indications that new federal bills will attempt to ban the sale of creatine to &lt;…", ,no longer populated,"If you haven't heard, there are credible indications that new federal bills will attempt to ban the sale of creatine to &lt; 18-year-olds; which is a mistake.

I am 100% in favor of similar restrictions for countless other supplements/ingredients, but CM shouldn't be on that list.",2025-02-27T03:14:32.000Z,post data removed,,0,305,0,47,,"If you haven't heard, there are credible indications that new federal bills will attempt to ban the sale of creatine to &lt; 18-year-olds; which is a mistake.

I am 100% in favor of similar restrictions for countless other supplements/ingredients, but CM shouldn't be on that list."
445440444,https://twitter.com/joerogan/status/1893882612038463728,,Twitter,10183319,Joe Rogan,blank_for_now,blank_for_now,"{""follower_count"":15227497,""following_count"":3941,""like_count"":null,""post_count"":45864,""views_count"":null,""comment_count"":null,""share_count"":null}",RT @WorldAndScience: Incredible: A collection of multi-planet systems discovered within the Milky Way galaxy by the Kepler Space Telescope!…, ,no longer populated,"Incredible: A collection of multi-planet systems discovered within the Milky Way galaxy by the Kepler Space Telescope!

(Credit: Ethan Kruse/NASA Goddard) https://t.co/2Amj5pzlHu",2025-02-24T04:36:16.000Z,post data removed,,0,1264,0,7,,"Incredible: A collection of multi-planet systems discovered within the Milky Way galaxy by the Kepler Space Telescope!

(Credit: Ethan Kruse/NASA Goddard) https://t.co/2Amj5pzlHu"
445271011,https://twitter.com/joerogan/status/1893846380201890056,,Twitter,10183319,Joe Rogan,blank_for_now,blank_for_now,"{""follower_count"":15227497,""following_count"":3941,""like_count"":null,""post_count"":45864,""views_count"":null,""comment_count"":null,""share_count"":null}",Thank you for the clarification!, ,no longer populated,@joerogan @Google Android backups are encrypted and no one can access them except you; it’s been that way since 2018. https://t.co/VUbDwuSMZT,2025-02-24T02:12:17.000Z,post data removed,,15344,671,727,1633785,,@joerogan @Google Android backups are encrypted and no one can access them except you; it’s been that way since 2018. https://t.co/VUbDwuSMZT
445086207,https://twitter.com/joerogan/status/1893736496387043601,,Twitter,10183319,Joe Rogan,blank_for_now,blank_for_now,"{""follower_count"":15223840,""following_count"":3941,""like_count"":null,""post_count"":45863,""views_count"":null,""comment_count"":null,""share_count"":null}",RT @JoshWalkos: In a stunning new preprint researchers found that between 1994-2023 not one of the 82 “climate science” papers they identif…, ,no longer populated,"In a stunning new preprint researchers found that between 1994-2023 not one of the 82 “climate science” papers they identified had a financial or non-financial COI disclosure from at least one author. 

The research also found that funding from NGOs was a significant predictor of studies reporting a positive association between climate change and hurricane behavior.

In other words the “science” is bought and then presented to you as trustworthy in order to push through a sociopathic agenda intended to seize and consolidate power at the rest of our expense.",2025-02-23T18:55:39.000Z,post data removed,,0,3226,0,26,,"In a stunning new preprint researchers found that between 1994-2023 not one of the 82 “climate science” papers they identified had a financial or non-financial COI disclosure from at least one author. 

The research also found that funding from NGOs was a significant predictor of studies reporting a positive association between climate change and hurricane behavior.

In other words the “science” is bought and then presented to you as trustworthy in order to push through a sociopathic agenda intended to seize and consolidate power at the rest of our expense."
